address,approval_date,business_term,company_name,company_state,company_type,company_url,email,english_name,industry,latest_update_time,legal_person,operation_scope,organization_code,registered_address,registered_capital,registration_authority,registration_number,registration_time,taxpayer_number,telephone_number,uniform_credit_code
安徽省六安市霍山佛子岭镇,2017-09-22,2003-11-28至2020-11-27,安徽迎驾贡酒股份有限公司,存续,其他股份有限公司(上市),www.xn--3bsp83k6me14d.cn,yjgj@yingjia.cn,"Anhui Yingjia Distillery Co.,Ltd.",酒、饮料和精制茶制造业,2018-09-03,倪永培, 白酒及其他酒研发、生产与销售；粮食等原辅料收购；饲料加工、销售。包装装潢、装订及其他印刷相关服务、纸制品制造与销售(分公司经营）；瓶罐、瓶盖、特种容器、药品包装材料、模具制造与销售（分公司经营）。自营和代理各类商品技术的进出口（国家限定公司经营或禁止进出口的商品和技术除外）（依法须经批准的项目，经相关部门批准后方可开展经营活动） ,756807242,安徽省六安市霍山佛子岭镇,80000万人民币,六安市工商行政和质量技术监督管理局,341525000005393,2003-11-28,91341500756807242A,5231266,91341500756807242A
合肥市高新区铭传路1000号,2018-07-18,1998-09-23至无固定期限,安徽国风塑业股份有限公司,存续,股份有限公司(上市、国有控股),www.guofeng.com,ir@guofeng.com,"Anhui Guofeng Plastic Industry Co.,Ltd.",橡胶和塑料制品业,2018-08-28,黄琼宜, 包装膜材料、预涂膜材料、电容器用薄膜、聚酰亚胺薄膜、电子信息用膜材料、高分子功能膜材料、工程塑料、木塑新材料、塑料化工新材料、塑胶建材及附件、其他塑料制品生产、销售；相关原辅材料生产、销售；企业自产产品及相关技术出口业务（国家限定公司经营或禁止出口商品除外）；企业生产、科研所需的原辅材料、仪器仪表、机械设备、零配件及技术进口（国家限定公司经营或禁止进口的商品除外）。（依法须经批准的项目，经相关部门批准后方可开展经营活动） ,705045831,合肥市高新区铭传路1000号,73944.973万人民币,合肥市高新开发区市场监督管理局,340000000032171,1998-09-23,91340100705045831J,0551-68560802,91340100705045831J
安徽省芜湖市经济技术开发区电器部件园(九华北路118号),2016-12-27,1998-05-15至无固定期限,安徽中电兴发与鑫龙科技股份有限公司,存续,股份有限公司(上市、自然人投资或控股),www.ah-zdxl.com,xlmch16@126.com,"Anhui Sinonet & Xinlong Science & Technology Co.,Ltd.",其他服务业,2018-08-30,束龙胜, 软件开发，计算机信息系统集成及技术研发，安全技术防范工程设计、施工，电子与智能化工程施工，电子、机电设备安装，音频、视频设备安装，民航空管工程及机场弱电系统工程施工，设计、安装有线电视基站、共用天线(涉及前置许可的除外），设计、安装机房设备，计算机软硬件及外围设备、机械设备、电器设备、通讯设备销售，电气机械及器材制造，工业过程控制及监控系统、计算机应用服务与综合信息网络工程、电子声像工程、各种智能化系统和技术防范工程设计、制造、施工、安装、维修、调试、销售及技术服务；电力工程、建筑工程、市政公用工程、环保工程的设计、施工与项目管理，工程造价咨询，工程信息咨询，电力技术咨询，招投标代理，工程监理，经营本企业自产产品及相关技术的出口和科研所需的原辅材料、仪器仪表、机械设备、零配件及相关技术的进口（国家限定经营或禁止进出口的商品除外），进料加工和“三来一补”。（依法须经批准的项目，经相关部门批准后方可开展经营活动）*** ,149661982,安徽省芜湖市经济技术开发区电器部件园(九华北路118号),70396.066万人民币,芜湖市工商行政管理局,340200000135548,1998-05-15,91340200149661982L,0553-5772678,91340200149661982L
合肥市高新区习友路1699号,2018-05-07,2007-07-11至2057-07-10,阳光电源股份有限公司,存续,股份有限公司(台港澳与境内合资、上市),www.sungrowpower.com,zhouys@sungrowpower.com,"Hefei Sunshine Power Supply Co.,Ltd.",电气机械和器材制造业,2018-08-28,曹仁贤, 新能源发电设备、分布式电源、及其配套产品的研制、生产、销售、服务、系统集成及技术转让；新能源发电工程的设计、开发、投资、建设和经营；电力电子设备、电气传动及控制设备、不间断电源、储能电源、电能质量控制装置的研制、生产及销售。 ,149209742,合肥市高新区习友路1699号,145225.86万人民币,合肥市高新开发区市场监督管理局,340000400000058,2007-07-11,913401001492097421,0551-65327878,913401001492097421
安徽省蚌埠市东海大道张公山路南侧,2017-10-10,1998-06-15至无固定期限,安徽水利开发股份有限公司,存续,其他股份有限公司(上市),www.cahsl.com,ahsj070@163.com,"Water Resources Development Co.,Ltd.",土木工程建筑业,2018-09-04,张晓林, 水利水电工程、建筑工程、公路工程、港口与航道工程、市政公用工程、机电工程、城市园林绿化工程的施工；桥梁工程专业施工；工程勘察、规划、设计、咨询服务；基础设施及环保项目投资、运营；水利水电资源开发；房地产开发；金属结构加工、制作、安装；建筑机械、材料租赁、销售。（依法须经批准的项目，经相关部门批准后方可开展经营活动） ,711790416,安徽省蚌埠市东海大道张公山路南侧,143430.023万人民币,蚌埠市工商行政和质量技术监督管理局,340000000010716,1998-06-15,91340300711790416H,0552-3950265,91340300711790416H
合肥市高新区习友路4477号,2018-08-03,2000-03-30至无固定期限,惠而浦（中国）股份有限公司,存续,股份有限公司(中外合资、上市),www.diqua.com,hs1029@whirlpool-china.com,Whrilpool(China)Co.Ltd,电气机械和器材制造业,2018-08-28,艾小明, 洗衣机、冰箱、微波炉、洁身器、空气净化器及其它相关产品、电子程控器、离合器、电机、控制器、电磁炉、电烤箱、电饭煲、烤面包机、面包机、咖啡机、浓缩咖啡机、电饼铛、咖啡研磨机、酸奶机、三明治机、电水壶、电水瓶、电压力锅、电蒸锅、电动打蛋器、豆浆机、榨汁机、搅拌机、食品加工机、吸尘器、电熨斗、挂烫机、加湿器、除湿机、电扇、空调扇、取暖器、家用净水器、水质软化器、空调、热水器、新风系统、冷冻箱、冷藏箱、清洁机、干衣机、照明设备、灯具、抽油烟机、燃气灶、灶具、消毒柜、洗碗机、电蒸炉及厨房电器的生产、销售、服务和存储（除危险品）。（依法须经批准的项目，经相关部门批准后方可开展经营活动） ,610307130,合肥市高新区习友路4477号,76643.9万人民币,合肥市高新开发区市场监督管理局,340100400002170,2000-03-30,91340100610307130N,0551-65338027,91340100610307130N
淮北经济开发区新区石山路6号,2017-09-28,2000-10-31至无限期,华孚时尚股份有限公司,存续,其他股份有限公司(上市),www.e-huafu.com/,dingmin@e-huafu.com,未公示,纺织业,,孙伟挺, 许可经营项目:棉花采购、加工。一般经营项目：纺织品、针织品、印染品、服装及其相关产品的制造、销售；纺织科学研究、信息咨询、代理服务；本企业自产产品和技术出口及本企业生产所需的原辅材料、仪器仪表、机械设备、零配件和技术进出口（国家限定公司经营和国家禁止进出口的商品及技术除外）。 ,72553187X,淮北经济开发区新区石山路6号,100731.9037万元,淮北市工商行政管理局,340000000022641,2000-10-31,9134060072553187XK,3010820,9134060072553187XK
安徽省铜陵市长江西路,2017-03-08,1996-11-12至无固定期限,铜陵有色金属集团股份有限公司,存续,其他股份有限公司(上市),www.tlys.cn,wangyq@tlys.cn,"Tongling Nonferrous Metals Group Co.,Ltd.",有色金属矿采选业,2018-08-28,杨军, 铜、铁采选，硫铁矿、金矿采选（限铜陵有色股份天马山黄金矿业公司经营），压缩、液化气体生产，硫酸生产，生活饮用水制水、供水（限动力厂经营），有色金属冶炼及压延加工，金、银、稀有贵金属冶炼及压延加工，铁球团、硫酸铜、电子产品生产、加工、销售，电气机械和器材、普通机械、电缆盘制造，废旧金属回收购、加工，进出口业务，矿产品、钢材、化工产品销售，信息技术服务，有线电视服务产品销售，广告业务，固体矿产勘查（丙级），设备设施维修、安装、改造及调试，机械制作加工，铁精砂购销，危险化学品生产（限分公司经营）。（依法须经批准的项目，经相关部门批准后方可开展经营活动） ,148973642,安徽省铜陵市长江西路,1052653.331万人民币,铜陵市工商行政管理局,340000000000848,1996-11-12,913407001489736421,0562-5861225,913407001489736421
